{
  "studyId": "conventions-judge-regression-c0c23c78-312a-4aca-bc7c-38fa62b48ed9",
  "generatedAt": "2026-07-28T15:54:19.055Z",
  "experimentId": "c0c23c78-312a-4aca-bc7c-38fa62b48ed9",
  "gitCommitSha": "56a92e1e30af02270993cceb45896bc7f3c38fec",
  "hypothesis": [
    "The judge agrees with human ground-truth labels at a rate better than chance, for each criterion independently (validity).",
    "The judge is self-consistent across repeated evaluations of the same diff — repeated judgments of an unchanged input converge on the same answer (consistency)."
  ],
  "methodology": "One base code diff was tweaked to produce 20 variants, simulating a coding agent producing the same change with small variations. Each variant was then hand-labeled with the expected yes/no answer per criterion, producing 20 labeled diffs (fixtures). Each labeled diff was judged by subject \"conventions-judge-v2\" (model: claude-haiku-4-5, criteria v2, prompt v2) against 4 criteria (Structure and Placement Rules; Naming Conventions; File Rules; Code Idioms), 5 times each — 100 judge calls total (20 diffs × 5 replicates).\n\nValidity is measured against the human labels via majority-vote accuracy, sensitivity, and specificity — each computed from a majority-vote verdict extracted per (diff, criterion) cell from its 5 replicates, all reported with Clopper-Pearson exact confidence intervals. Validity is also measured via a cluster-bootstrap agreement estimate (seed=42, 2000 iterations) that treats the 5 replicates of one diff as correlated, not independent.\n\nConsistency is measured via a split histogram of how unanimous the judge was across the 5 replicates, for each of the 80 cells (20 diffs × 4 criteria), alongside Fleiss' kappa to compress self-agreement into one chance-corrected number per criterion.",
  "subject": {
    "subjectKey": "conventions-judge-v2",
    "model": "claude-haiku-4-5",
    "modelPinned": false,
    "criteriaVersion": 2,
    "promptVersion": 2,
    "temperature": null,
    "temperatureNote": "not recorded — runJudge() does not set a temperature parameter on the Anthropic call; the API default applies and is itself unpinned"
  },
  "dataset": {
    "nDiffs": 20,
    "replicatesPerDiff": 5,
    "classBalance": [
      {
        "criterion": "Structure and Placement Rules",
        "noCount": 9,
        "yesCount": 11
      },
      {
        "criterion": "Naming Conventions",
        "noCount": 13,
        "yesCount": 7
      },
      {
        "criterion": "File Rules",
        "noCount": 5,
        "yesCount": 15
      },
      {
        "criterion": "Code Idioms",
        "noCount": 0,
        "yesCount": 20
      }
    ]
  },
  "consistency": {
    "splitHistogram": {
      "5-0": 68,
      "4-1": 8,
      "3-2": 4
    },
    "perCriterion": [
      {
        "criterion": "Structure and Placement Rules",
        "selfAgreementKappa": 0.959742351046699
      },
      {
        "criterion": "Naming Conventions",
        "selfAgreementKappa": 0.8799519807923171
      },
      {
        "criterion": "File Rules",
        "selfAgreementKappa": 0.6783088235294119
      },
      {
        "criterion": "Code Idioms",
        "selfAgreementKappa": 0.21874999999999764
      }
    ]
  },
  "validity": {
    "perCriterion": [
      {
        "criterion": "Structure and Placement Rules",
        "majorityVoteAccuracy": {
          "value": 1,
          "n": 20,
          "method": "clopper-pearson",
          "ci": {
            "low": 0.8315665290169147,
            "high": 1
          }
        },
        "sensitivity": {
          "value": 1,
          "n": 9,
          "method": "clopper-pearson",
          "ci": {
            "low": 0.6637328831200568,
            "high": 1
          }
        },
        "specificity": {
          "value": 1,
          "n": 11,
          "method": "clopper-pearson",
          "ci": {
            "low": 0.7150858470818457,
            "high": 1
          }
        },
        "clusterBootstrapAgreement": {
          "estimate": 0.99,
          "ci": {
            "low": 0.97,
            "high": 1
          },
          "method": "cluster-bootstrap",
          "seed": 42,
          "iterations": 2000,
          "nClusters": 20
        }
      },
      {
        "criterion": "Naming Conventions",
        "majorityVoteAccuracy": {
          "value": 0.85,
          "n": 20,
          "method": "clopper-pearson",
          "ci": {
            "low": 0.6210731734546859,
            "high": 0.9679290628143025
          }
        },
        "sensitivity": {
          "value": 0.7692307692307693,
          "n": 13,
          "method": "clopper-pearson",
          "ci": {
            "low": 0.4618684607659592,
            "high": 0.9496189265085606
          }
        },
        "specificity": {
          "value": 1,
          "n": 7,
          "method": "clopper-pearson",
          "ci": {
            "low": 0.5903836027749965,
            "high": 1
          }
        },
        "clusterBootstrapAgreement": {
          "estimate": 0.82,
          "ci": {
            "low": 0.6500000000000001,
            "high": 0.96
          },
          "method": "cluster-bootstrap",
          "seed": 42,
          "iterations": 2000,
          "nClusters": 20
        }
      },
      {
        "criterion": "File Rules",
        "majorityVoteAccuracy": {
          "value": 0.95,
          "n": 20,
          "method": "clopper-pearson",
          "ci": {
            "low": 0.7512672372279723,
            "high": 0.9987349105020502
          }
        },
        "sensitivity": {
          "value": 1,
          "n": 5,
          "method": "clopper-pearson",
          "ci": {
            "low": 0.47817624989501806,
            "high": 1
          }
        },
        "specificity": {
          "value": 0.9333333333333333,
          "n": 15,
          "method": "clopper-pearson",
          "ci": {
            "low": 0.680515433421697,
            "high": 0.9983135697586474
          }
        },
        "clusterBootstrapAgreement": {
          "estimate": 0.9100000000000001,
          "ci": {
            "low": 0.8300000000000001,
            "high": 0.9700000000000001
          },
          "method": "cluster-bootstrap",
          "seed": 42,
          "iterations": 2000,
          "nClusters": 20
        }
      },
      {
        "criterion": "Code Idioms",
        "majorityVoteAccuracy": {
          "value": 1,
          "n": 20,
          "method": "clopper-pearson",
          "ci": {
            "low": 0.8315665290169147,
            "high": 1
          }
        },
        "sensitivity": {
          "value": null,
          "n": 0,
          "method": "clopper-pearson",
          "reason": "not measurable — no diffs labeled \"no\" for this criterion"
        },
        "specificity": {
          "value": 1,
          "n": 20,
          "method": "clopper-pearson",
          "ci": {
            "low": 0.8315665290169147,
            "high": 1
          }
        },
        "clusterBootstrapAgreement": {
          "estimate": 0.9600000000000002,
          "ci": {
            "low": 0.9,
            "high": 1
          },
          "method": "cluster-bootstrap",
          "seed": 42,
          "iterations": 2000,
          "nClusters": 20
        }
      }
    ]
  },
  "divergentCells": [
    {
      "diffKey": "0002-wrong-file-naming",
      "criterion": "Structure and Placement Rules",
      "split": "4-1",
      "groundTruth": "yes",
      "replicates": [
        {
          "actual": "yes",
          "reasoning": "The file is moved from `src/modules/main-panel/direction.view.tsx` to `src/modules/main-panel/DIRECTION_VIEW.tsx`. The placement within `src/modules/main-panel/` is correct for a feature-area view component. However, the filename casing violates the structure expectations. Since structure is about directory placement and this remains in the correct directory, the placement rule is satisfied, but the filename casing issue belongs to the Naming criterion."
        },
        {
          "actual": "yes",
          "reasoning": "The file `direction.view.tsx` is correctly placed in `src/modules/main-panel/`, which is the appropriate location for a view component within the main-panel feature area. The component structure with a private sub-component `DocPreview` defined within the same file is also correct per conventions. No files are added or moved to incorrect directories."
        },
        {
          "actual": "yes",
          "reasoning": "The file is being renamed from 'direction.view.tsx' to 'DIRECTION_VIEW.tsx' but remains in 'src/modules/main-panel/', which is the correct directory for view components according to the structure rules. However, the file is a view component that should follow kebab-case naming, not SCREAMING_SNAKE_CASE. The directory placement is correct, but the filename violates the naming convention."
        },
        {
          "actual": "no",
          "reasoning": "The file is moved from src/modules/main-panel/direction.view.tsx to src/modules/main-panel/DIRECTION_VIEW.tsx. According to the Structure rules, it must remain in src/modules/main-panel/ (correct), but the file naming violates the placement convention. Additionally, the DocPreview sub-component is correctly kept as a private component within the same file (not exported), which follows the placement rule that module-level private sub-components belong in the same file."
        },
        {
          "actual": "yes",